{
  "checkpoint": {
    "sequence": 0,
    "state": {
      "actors": {
        "demo.iris_kade": {
          "actor_id": "demo.iris_kade",
          "awards": {

          },
          "base_build": {
            "capabilities": [],
            "facets": {
              "agility": 2,
              "cunning": 3,
              "empathy": 4,
              "force": 2,
              "sense": 3,
              "tenacity": 4
            },
            "skills": {
              "athletics": 1,
              "craft": 1,
              "fighting": 1,
              "influence": 2,
              "investigation": 1,
              "medicine": 2,
              "performance": 2,
              "survival": 2
            },
            "talents": [
              "core.steady_voice",
              "core.bargain_maker"
            ]
          },
          "bonds": {
            "demo.mara_vale": {
              "affinity": 1,
              "obligations": [],
              "shared_events": [],
              "trust": 2
            }
          },
          "build": {
            "capabilities": [],
            "facets": {
              "agility": 2,
              "cunning": 3,
              "empathy": 4,
              "force": 2,
              "sense": 3,
              "tenacity": 4
            },
            "skills": {
              "athletics": 1,
              "craft": 1,
              "fighting": 1,
              "influence": 2,
              "investigation": 1,
              "medicine": 2,
              "performance": 2,
              "survival": 2
            },
            "talents": [
              "core.steady_voice",
              "core.bargain_maker"
            ]
          },
          "conditions": [],
          "controller": "player",
          "display_name": "Iris Kade",
          "flags": {

          },
          "growth": 0,
          "harm": 0,
          "identity": {
            "appearance_refs": [],
            "code": "Talk first, always",
            "drive": "Keep the market's people safe",
            "hindrance": "Cannot walk away from someone in pain",
            "name": "Iris Kade",
            "tell": "Hums when she is nervous"
          },
          "identity_triggers": [
            {
              "description": "Someone nearby is hurt. Stop and treat them, whatever it costs your schedule.",
              "disadvantage_effects": [
                {
                  "label": "An hour passes",
                  "op": "world.clock_advance",
                  "params": {
                    "amount": 1
                  }
                }
              ],
              "disadvantage_label": "Lose an hour treating strangers",
              "display_name": "Stop for someone in pain",
              "id": "iris.someone_in_pain"
            }
          ],
          "items": {
            "item.med_kit": 1
          },
          "known_facts": [],
          "ledger": [],
          "memories": [],
          "profile": {
            "accomplishments": []
          },
          "resolve": 1,
          "strain": 0,
          "trained_skills": [],
          "usage": {

          },
          "zone_id": "street"
        },
        "demo.mara_vale": {
          "actor_id": "demo.mara_vale",
          "awards": {

          },
          "base_build": {
            "capabilities": [],
            "facets": {
              "agility": 4,
              "cunning": 3,
              "empathy": 3,
              "force": 2,
              "sense": 4,
              "tenacity": 2
            },
            "skills": {
              "athletics": 1,
              "influence": 2,
              "investigation": 2,
              "medicine": 1,
              "sleight": 1,
              "stealth": 2,
              "survival": 1,
              "technology": 2
            },
            "talents": [
              "core.second_look",
              "core.field_engineer"
            ]
          },
          "bonds": {
            "demo.iris_kade": {
              "affinity": 1,
              "obligations": [],
              "shared_events": [],
              "trust": 1
            },
            "npc.rook": {
              "affinity": 1,
              "obligations": [],
              "shared_events": [],
              "trust": 0
            }
          },
          "build": {
            "capabilities": [],
            "facets": {
              "agility": 4,
              "cunning": 3,
              "empathy": 3,
              "force": 2,
              "sense": 4,
              "tenacity": 2
            },
            "skills": {
              "athletics": 1,
              "influence": 2,
              "investigation": 2,
              "medicine": 1,
              "sleight": 1,
              "stealth": 2,
              "survival": 1,
              "technology": 2
            },
            "talents": [
              "core.second_look",
              "core.field_engineer"
            ]
          },
          "conditions": [],
          "controller": "player",
          "display_name": "Mara Vale",
          "flags": {

          },
          "growth": 0,
          "harm": 0,
          "identity": {
            "appearance_refs": [],
            "code": "Never abandon a passenger",
            "drive": "Find the missing people from the night market",
            "hindrance": "Pursues disappearance leads despite urgent deliveries",
            "name": "Mara Vale",
            "tell": "Touches the seal on her courier bag"
          },
          "identity_triggers": [
            {
              "description": "The stranded passenger saw something. Stop and listen, even though the delivery window is closing.",
              "disadvantage_effects": [
                {
                  "label": "Delivery window missed",
                  "op": "fact.set",
                  "params": {
                    "fact_id": "fact.window_missed",
                    "value": true
                  }
                },
                {
                  "label": "Two hours pass",
                  "op": "world.clock_advance",
                  "params": {
                    "amount": 2
                  }
                }
              ],
              "disadvantage_label": "Miss the delivery window",
              "display_name": "Chase the disappearance lead",
              "id": "mara.passenger_lead"
            }
          ],
          "items": {
            "item.scrap_wire": 1,
            "tool.signal_kit": 1
          },
          "known_facts": [],
          "ledger": [],
          "memories": [],
          "profile": {
            "accomplishments": []
          },
          "resolve": 1,
          "strain": 0,
          "trained_skills": [],
          "usage": {

          },
          "zone_id": "street"
        },
        "npc.rook": {
          "actor_id": "npc.rook",
          "awards": {

          },
          "base_build": {
            "capabilities": [],
            "facets": {
              "agility": 3,
              "cunning": 2,
              "empathy": 2,
              "force": 3,
              "sense": 4,
              "tenacity": 4
            },
            "skills": {
              "athletics": 2,
              "fighting": 2,
              "influence": 2,
              "investigation": 2,
              "marksmanship": 2,
              "survival": 2
            },
            "talents": [
              "core.trail_reader",
              "core.second_look"
            ]
          },
          "bonds": {

          },
          "build": {
            "capabilities": [],
            "facets": {
              "agility": 3,
              "cunning": 2,
              "empathy": 2,
              "force": 3,
              "sense": 4,
              "tenacity": 4
            },
            "skills": {
              "athletics": 2,
              "fighting": 2,
              "influence": 2,
              "investigation": 2,
              "marksmanship": 2,
              "survival": 2
            },
            "talents": [
              "core.trail_reader",
              "core.second_look"
            ]
          },
          "conditions": [],
          "controller": "npc",
          "display_name": "Rook",
          "flags": {

          },
          "growth": 0,
          "harm": 0,
          "identity": {
            "appearance_refs": [],
            "code": "Never open the fixer's office",
            "drive": "Keep his post and his pension",
            "hindrance": "Owes the fixer money",
            "name": "Rook",
            "tell": "Jingles his keys"
          },
          "identity_triggers": [],
          "items": {

          },
          "known_facts": [],
          "ledger": [],
          "memories": [],
          "profile": {
            "accomplishments": []
          },
          "resolve": 1,
          "strain": 0,
          "trained_skills": [],
          "usage": {

          },
          "zone_id": "street"
        },
        "npc.tamsin": {
          "actor_id": "npc.tamsin",
          "awards": {

          },
          "base_build": {
            "capabilities": [],
            "facets": {
              "agility": 3,
              "cunning": 2,
              "empathy": 4,
              "force": 2,
              "sense": 4,
              "tenacity": 3
            },
            "skills": {
              "athletics": 2,
              "influence": 2,
              "investigation": 2,
              "medicine": 2,
              "performance": 2,
              "survival": 2
            },
            "talents": [
              "core.trail_reader",
              "core.steady_voice"
            ]
          },
          "bonds": {

          },
          "build": {
            "capabilities": [],
            "facets": {
              "agility": 3,
              "cunning": 2,
              "empathy": 4,
              "force": 2,
              "sense": 4,
              "tenacity": 3
            },
            "skills": {